<?xml version="1.0" encoding="UTF-8" standalone="no" ?>
<!DOCTYPE agenda SYSTEM "agenda.dtd">
<agenda>
    <contacto>
        <nombre>Pedro casas</nombre>
        <direccion> Calle avalladolid </direccion>
        <ciudad> Vitoria </ciudad>
        <provincia>Alava</provincia>
        <cp>01003</cp>
        <numeros>
            <telefono>896</telefono>
            <fax>3654</fax>
        </numeros>
        <email>@gmail</email>
        <web>milop.com</web>
        <companyia>mercedes</companyia>
    </contacto>
</agenda>









